{
  "$schema": "http://json-schema.org/draft-07/schema#",
  "title": "StatspAI Orchestrator Policy",
  "type": "object",
  "required": [
    "version",
    "layer",
    "purpose",
    "default_mode",
    "trace_path",
    "report_path",
    "state_path",
    "allow_execute_adapters",
    "dry_run_only_adapters",
    "blocked_adapters",
    "allowed_side_effect_levels",
    "blocked_side_effect_levels",
    "allow_network",
    "allow_human_auth",
    "allow_placeholder_commands",
    "allow_recursive_preflight",
    "command_allowlist",
    "required_inputs",
    "stop_conditions"
  ],
  "additionalProperties": false,
  "properties": {
    "version": {"type": "string"},
    "layer": {"type": "string", "enum": ["second"]},
    "purpose": {"type": "string"},
    "default_mode": {"type": "string", "enum": ["dry-run", "execute"]},
    "trace_path": {"type": "string"},
    "report_path": {"type": "string"},
    "state_path": {"type": "string"},
    "allow_execute_adapters": {"type": "array", "items": {"type": "string"}},
    "dry_run_only_adapters": {"type": "array", "items": {"type": "string"}},
    "blocked_adapters": {"type": "array", "items": {"type": "string"}},
    "allowed_side_effect_levels": {"type": "array", "items": {"type": "string"}},
    "blocked_side_effect_levels": {"type": "array", "items": {"type": "string"}},
    "allow_network": {"type": "boolean"},
    "allow_human_auth": {"type": "boolean"},
    "allow_placeholder_commands": {"type": "boolean"},
    "allow_recursive_preflight": {"type": "boolean"},
    "command_allowlist": {"type": "array", "items": {"type": "string"}},
    "required_inputs": {"type": "array", "items": {"type": "string"}},
    "stop_conditions": {"type": "array", "items": {"type": "string"}}
  }
}
